title,content,price,url
The Ordinary Salicylic Acid 2% Masque (Mascarilla Anti-Imperfecciones Con Ácido Salicílico),N/A,$380.00,https://www.fahorro.com/the-ordinary-salicylic-acid-2-masque-mascarilla-anti-imperfecciones-con-acido-salicilico.html
Arena Para Gato Cat's Pride No Aglutinante 100% Natural 9.07 Kg,N/A,$544.88,https://www.fahorro.com/cats-pride-arena-sanitaria-para-gatos-cats-pride-natural-arena-no-aglutinante-libre-de-fragancia-gato-041788015107.html
TIMCO Secadora Tourmaline + Ión con Boquilla,N/A,$428.68,https://www.fahorro.com/secadora-tourmaline-ion-c-boquilla-timco-ct-1600.html
Clinique Tónico Facial anti-blemish clarifying lotion 200ml,N/A,$570.00,https://www.fahorro.com/clinique-tonico-facial-anti-blemish-clarifying-lotion-200ml.html
Cepillo Frida Baby Removedor de Escamas para Bebé Recien Nacido Color Azul,N/A,$492.88,https://www.fahorro.com/frida-baby-cuidado-del-bebe-cepillo-removedor-de-escamas-para-bebes-851877006509.html
"Cuchillos de Cocina de Acero Inoxidable con Base, Afilador y Tijeras 15 Pz",N/A,$1379.58,https://www.fahorro.com/cuchillos-de-cocina-de-acero-inoxidable-con-base-afilador-y-tijeras-15-pz.html
NUPEC Alimento Perro Adulto Raza Pequeña 2 kg,N/A,$332.22,https://www.fahorro.com/nupec-croquetas-adulto-razas-pequenas-7503008553248.html
Dancing Disco Robot Robot Bailarín Luces Música 360°,N/A,$519.08,https://www.fahorro.com/dancing-disco-robot-robot-bailarin-con-luces-y-musica-360.html
Conair Recortadora Recargable Cromo Negro,N/A,$1281.67,https://www.fahorro.com/recortadora-recargable-cromo-negro-conair-recortadoras-74108421654.html
SASCHA FITNESS BCAA's Suplemento de Aminoácidos Sabor Lima Limón,N/A,$1599.00,https://www.fahorro.com/sascha-fitness-bcaa-s-lima-limon.html
TIMCO Parrilla Sandwichera Pannini Antiadherente,N/A,$692.00,https://www.fahorro.com/parrilla-sandwichera-pannini-antiadhente-timco-paninid045n.html
Turbos Farm Tractor con Luces y Sonidos 6+,N/A,$451.69,https://www.fahorro.com/turbos-farm-tractor-tractor-con-luces-y-sonidos-para-ninos-6.html
BURT'S BEES Shampoo Avena y Miel para Perro 476 ml,N/A,$660.00,https://www.fahorro.com/burts-bees-higiene-y-cuidado-para-perros-burts-bees-shampoo-de-avena-y-miel-perro-pieles-sensibles-476ml-742797772103.html
Perfume Nautica Classic Eau de Toilette Hombre 100 ml,N/A,$295.99,https://www.fahorro.com/perfume-nautica-classic-eau-de-toilette-hombre-100ml.html
PAÑAL FISHER PRICE Etapa 5 Niña 40 Piezas,N/A,$282.65,https://www.fahorro.com/panal-para-bebe-etapa-5-nina-fisher-price-40-piezas-5784.html
Clinique Base Even Better Cliincal Foundation Spf 20 Cn 1 Alabaster 30 Ml,N/A,$999.00,https://www.fahorro.com/clinique-base-even-better-cliinical-foundation-spf-20-30ml.html
ON Essential Amino Suplemento de Aminoácidos Sabor Fusión de Frutas,N/A,$809.00,https://www.fahorro.com/on-essential-amino-sabor-fusion-de-frutas.html
Smartwatch Pantalla Táctil AMOLED 1.96” con Funciones de Salud IP67,N/A,$1034.40,https://www.fahorro.com/smartwatch-pantalla-tactil-amoled-1-96-con-funciones-de-salud-ip67.html
CRAZY AARONS Slime Bubblegum Marshmallow con aroma a fiesta de sabores,N/A,$340.83,https://www.fahorro.com/crazy-aaron-s-slime-sensorial-con-aroma-dulce-bubblegum-marshmallow.html
Koddle Guante para Limpieza Mascotas 20pz,N/A,$67.60,https://www.fahorro.com/koddle-guante-humedo-para-aseo-de-mascotas-20pzas.html
Perfume CK One Eau de Toilette Unisex 200 ml,N/A,$999.78,https://www.fahorro.com/perfume-ck-one-eau-de-toilette-unisex-200ml.html
Evenflo Mamila Bold de Flujo Libre 2 Piezas,N/A,$152.31,https://www.fahorro.com/evenflo-advanced-set-de-2-mamilas-bold-cuello-ancho-flujo-lento-para-bebes-de-0-a-3-meses.html
TIMCO Plancha para Cabello Cerámica Infusión de Carbón Activado,N/A,$385.96,https://www.fahorro.com/plancha-ceramica-con-infusion-de-carbon-activado.html
Clinique Crema Hidratante para Ojos 15ml,N/A,$899.00,https://www.fahorro.com/clinique-crema-para-ojos-aae-serum-depuf-eye-mass-15ml.html
QUEST Crackers Sabor Spicy Cheddar Snack con Proteína Caja con 4,N/A,$259.00,https://www.fahorro.com/quest-caja-de-4-crackers-sabor-spicy-cheddar.html
TIMCO Licuadora Vaso Plástico 1.4 Litros Libre de BPA,N/A,$457.89,https://www.fahorro.com/licuadora-vaso-plastico-1-4l-libre-de-bpa-timco-licx803.html
LEGO Juego de Construcción Minecraft La Casa De Cerdo Bebé,N/A,$699.00,https://www.fahorro.com/lego-la-casa-cerdo-bebe-673419404686.html
NUPEC Felino Kitten Gatitos 3 kg,N/A,$583.33,https://www.fahorro.com/nupec-croquetas-kitten-7503026084120.html
Perfume Invictus Eau de Toilette Hombre 100 ml,N/A,$2904.62,https://www.fahorro.com/perfume-invictus-eau-de-toilette-hombre-100ml.html
Set Paris Hilton Can Can Eau de Parfum Mujer 100 ml 4 Piezas,N/A,$1166.96,https://www.fahorro.com/set-paris-hilton-can-can-eau-de-parfum-mujer-100ml-4pzs.html
TIMCO Plancha Alaciadora Profesional Purple Titanio Ionizado,N/A,$1818.00,https://www.fahorro.com/plancha-alaciadora-profesional-purple-titanio-ionizado-timco.html
YUYA Spray Fijador de Maquillaje 60 ml,N/A,$238.46,https://www.fahorro.com/spray-fijador-de-maquillaje-yuya-60-ml-4308.html
The Ordinary Vitamin C 23% Suspension + Ha Spheres 2% (Suspensión Antiedad Y Antioxidante Con Vitamina C),N/A,$225.00,https://www.fahorro.com/the-ordinary-vitamin-c-23-suspension-ha-spheres-2-suspension-antiedad-y-antioxidante-con-vitamina-c.html
HEALTHADDICTION Omega 3 60 Caps,N/A,$236.24,https://www.fahorro.com/healthaddiction-omega-3-60-caps.html
TIMCO Jarra Eléctrica Hervidora 1.7 Litros Color Negra,N/A,$567.74,https://www.fahorro.com/jarra-electrica-timco-je-v02-negra-1-7l.html
Mochila Antirrobo con Candado y Puerto USB,N/A,$602.96,https://www.fahorro.com/mochila-antirrobo-mini-con-candado-y-puerto-usb.html
