title,content,price,url
TIMCO Freidora de Aire TurboAir 3.5 Litros Sin Aceite,N/A,$1748.75,https://www.fahorro.com/freidora-de-aire-3-5-l-sin-aceite-turboair-timco-af002.html
Perfume Guerlain Mon Guerlain Eau de Parfum Mujer 100 ml,N/A,$1686.67,https://www.fahorro.com/perfume-guerlain-mon-guerlain-eau-de-parfume-mujer-100ml.html
Clinique Suero Smart Clinical Repair Wrinkle Corrector Serum 30 Ml,N/A,$1599.00,https://www.fahorro.com/clinique-suero-smart-clinical-repair-wrinkle-corrector-serum-30ml.html
TIMCO Sandwichera 2 Piezas Placas Antiadherentes,N/A,$347.06,https://www.fahorro.com/sandwichera-para-2-piezas-placas-antiadherente-timco-sa-811.html
Perfume Jean Paul Gaultier Le Beau Eau de Toilette Hombre 125 ml,N/A,$2498.57,https://www.fahorro.com/perfume-jean-paul-gaultier-le-beau-eau-de-toilette-hombre-125ml.html
BIRDMAN Proteína Vegetal Falcon Performance Choco Bronze 1.14 kg,N/A,$1240.04,https://www.fahorro.com/falcon-performance-proteina-vegetal-choco-bronze-1-14-kg.html
Clinique Labial Almost tono Black Honey 1.9 G,N/A,$499.00,https://www.fahorro.com/clinique-labial-almost-l-s-black-honey-1-9-g.html
NINJA Licuadora Blast Portátil 500 ml,N/A,$1487.17,https://www.fahorro.com/ninja-licuadora-portatil-blast-vaso-500-ml.html
REVLON Labial Líquido ColorStay Satin Ink Tono Wild Ride 5 ml,N/A,$284.62,https://www.fahorro.com/revlon-labial-satin-ink-wild-ride.html
The Ordinary The Clear Set (Set De Piel Con Tendencia A Acné),N/A,$445.00,https://www.fahorro.com/the-ordinary-the-clear-set-set-de-piel-con-tendencia-a-acne.html
Perfume GA Giorgio Armani Acqua di Gio Profondo Parfum Eau de Parfum Hombre 200 ml,N/A,$3250.00,https://www.fahorro.com/perfume-acqua-di-gio-profondo-parfum-eau-de-parfume-hombre-200ml.html
HERSHEY'S Lip Balm sabor Milk 3.5 g,N/A,$77.78,https://www.fahorro.com/lip-balm-milk-hershey-s-3-5-g-4305.html
The Ordinary Soothing & Barrier Support Serum (Suero Reparador Para Rostro),N/A,$415.00,https://www.fahorro.com/the-ordinary-soothing-barrier-support-serum-suero-reparador-para-rostro.html
Body Mist Ariana Grande Cloud Mujer 236 ml,N/A,$448.79,https://www.fahorro.com/perfume-z7-ariana-grande-cloud-body-mist-mujer-236ml.html
Conair Estilizador DigitalAire 4 Cabezas,N/A,$3985.33,https://www.fahorro.com/multifuncional-digitalaire-advancing-styling-technology-4-cabezales-conair-cepillos-de-aire-74108490186.html
Perfume Armaf Club de Nuit Intense Eau de Toilette Hombre 105 ml,N/A,$1175.56,https://www.fahorro.com/perfume-armaf-club-de-nuit-intense-eau-de-toilette-hombre-105ml.html
The Ordinary Multi-Peptide Eye Serum (Serum Para El Contorno De Ojos Con Péptidos),N/A,$630.00,https://www.fahorro.com/the-ordinary-multi-peptide-eye-serum-serum-para-el-contorno-de-ojos-con-peptidos.html
HONEST Shampoo y Gel de Baño Corporal con Lavanda 295 ml,N/A,$335.66,https://www.fahorro.com/shampo-body-wash-lavanda-relajante-295-ml.html
Perfume Lattafa Qaed Al Fursan Eau de Parfum Unisex 90 ml,N/A,$572.73,https://www.fahorro.com/perfume-lattafa-qaed-al-fursan-eau-de-parfume-unisex-90ml.html
Perfume Katy Perry Purr Eau de Parfum Mujer 100 ml,N/A,$944.44,https://www.fahorro.com/perfume-katy-perry-purr-eau-de-parfume-mujer-100ml.html
GRANDPET Alimento Húmedo Ternera Cordero 100 g,N/A,$18.61,https://www.fahorro.com/alimento-bravo-mascotas-7501856500919.html
The Ordinary Niacinamide 10% + Zinc 1% (Suero Para Imperfecciones Con Niacinamida Y Zinc,N/A,$145.00,https://www.fahorro.com/the-ordinary-niacinamide-10-zinc-1-suero-para-imperfecciones-con-niacinamida-y-zinc.html
Clinique Hidratante Smart Lifting Face + Neck Cream 50 Ml,N/A,$2350.00,https://www.fahorro.com/clinique-hidratante-smart-lifting-face-neck-cream-50-ml.html
The Ordinary Glycolic Acid 7% Exfoliating Toner 240Ml ( Tónico Exfoliante Con Ácido Glicólico),N/A,$320.00,https://www.fahorro.com/the-ordinary-glycolic-acid-7-exfoliating-toner-240ml-tonico-exfoliante-con-acido-glicolico.html
REPUBLIC COSMETICS Mascarilla de Ácido Hialurónico 30 g,N/A,$29.41,https://www.fahorro.com/mascarilla-de-acido-hialuronico-republic-cosmetics-30-g-9128.html
Clinique Hidratante Moisture Surge 100Hr 15 Ml,N/A,$360.00,https://www.fahorro.com/clinique-hidratante-moisture-surge-100hr-15ml.html
REVLON Lápiz Labial ColorStay Suede Ink Tono In The Zone 4.2 gr,N/A,$271.25,https://www.fahorro.com/colorstaysuedeinklipstick17.html
Evenflo Mamila Advanced Bold de Silicón 2 Piezas,N/A,$146.15,https://www.fahorro.com/advanced-by-evenflo-mamila-bold-2-pz.html
The Ordinary Growth Factors 15% Solution (Suero Con 3 Factores De Crecimiento Para Mejorar Signos De La Edad),N/A,$335.00,https://www.fahorro.com/the-ordinary-growth-factors-15-solution-suero-con-3-factores-de-crecimiento-para-mejorar-signos-de-la-edad.html
Perfume Lancôme La Vie Est Belle Iris Absolu Eau de Parfum Mujer 100 ml,N/A,$3543.64,https://www.fahorro.com/perfume-lancome-la-vie-est-belle-iris-absolu-eau-de-parfume-mujer-100ml.html
Clinique Desmaquillante take the day off cleansing balm 125ml,N/A,$1199.00,https://www.fahorro.com/clinique-desmaquillante-take-the-day-off-cleansing-balm-125ml.html
XIAOMI REDMI BUDS 6 Play Audífonos Bluetooth Blue Sonido Potente,N/A,$293.75,https://www.fahorro.com/redmi-audifonos-buds-6-play-azul.html
Blender Bottle Termo Shaker Strada Steel 24oz Color Azul,N/A,$813.85,https://www.fahorro.com/termo-blender-bottle-strada-steel-24oz-azul.html
XIAOMI WATCH 2 Edicion Black con Strap Negro,N/A,$4284.29,https://www.fahorro.com/smartwatch-xiaomi-watch-2-black-edition-6941812764350.html
TIMCO Tenaza Rizadora Extra Larga 22 cm Gold Radian Barril 19 Milímetros,N/A,$1161.82,https://www.fahorro.com/tenaza-rizadora-extra-larga-22-cm-gold-radian-tenaza-barril-19-mm-timco-trx-19.html
Clinique Base Even Better Cliincal Foundation Spf 20 Cn 58 Ivory 30 Ml,N/A,$999.00,https://www.fahorro.com/clinique-base-even-better-cliinical-foundation-spf-20-30ml1.html
Perfume Cacharel Amor Amor Eau de Toilette Mujer 100 ml,N/A,$1447.50,https://www.fahorro.com/amor-amor-de-cacharel-eau-de-toilette-de-dama-100-ml.html
REVLON Lápiz Labial ColorStay Suede Ink Tono Bread Winner 4.2 gr,N/A,$293.85,https://www.fahorro.com/colorstaysuedeinklipstick15.html
The Ordinary Azelaic Acid Suspension 10% (Suspensión Iluminadora Con Ácido Azelaico ),N/A,$310.00,https://www.fahorro.com/the-ordinary-azelaic-acid-suspension-10-suspension-iluminadora-con-acido-azelaico.html
YUYA Máscara para Pestañas 10 Aceites Esenciales 10 g,N/A,$233.33,https://www.fahorro.com/mascara-para-pestanas-10-aceites-esenciales-yuya-10-g-3905.html
"Conair Curl Secret Next Generation Gris/Dorado 1 1/4""",N/A,$2620.00,https://www.fahorro.com/inf-curl-secadoraret-next-generation-gris-dorado-conair-estilizadores-74108484888.html
The Ordinary Salicylic Acid 2% Solution (Suero Anti-Imperfecciones Con Ácido Salicílico),N/A,$165.00,https://www.fahorro.com/the-ordinary-salicylic-acid-2-solution-suero-anti-imperfecciones-con-acido-salicilico.html
Clinique Corrector Even Better Concealer 6ml Cool Neutral,N/A,$730.00,https://www.fahorro.com/clinique-corrector-even-better-concealer-6ml5.html
Perfume Jean Paul Gaultier Scandal Le Parfum Eau de Parfum Hombre 100 ml,N/A,$3561.82,https://www.fahorro.com/perfume-jean-paul-gaultier-scandal-le-parfum-eau-de-parfume-hombre-100ml.html
"Reloj Deportivo Resistente Agua Digital, Alarma, Cronómetro",N/A,$343.84,https://www.fahorro.com/reloj-deportivo-resistente-agua-digital-alarma-cronometro-1251.html
Clinique Crema para ojos all about eyes rich 15ml,N/A,$899.00,https://www.fahorro.com/clinique-crema-para-ojos-all-about-eyes-rich-15ml.html
Perfume Montblanc Signature Eau de Parfum Mujer 90 ml,N/A,$1365.00,https://www.fahorro.com/perfume-montblanc-signature-eau-de-parfume-mujer-90ml.html
ON GS 100% Whey Doble Chocolate Proteína en Polvo 5 LB,N/A,$2399.00,https://www.fahorro.com/on-gs-100-whey-doble-chocolate-bote-5-lb.html
SMARTSHAKE Original2Go One Contenedor Mezclador Gris 800ml,N/A,$429.00,https://www.fahorro.com/smartshake-original2go-one-gris-800ml.html
Perfume Dolce & Gabbana Devotion Eau de Parfum Mujer 100 ml,N/A,$3283.48,https://www.fahorro.com/perfume-dolce-gabbana-devotion-eau-de-parfume-mujer-100ml.html
Clinique Base Even Better Cliincal Foundation Spf 20 Cn 7 Vanilla 30 Ml,N/A,$999.00,https://www.fahorro.com/clinique-base-even-better-cliinical-foundation-spf-20-30ml3.html
TIMCO Cepillo Eléctrico Giratorio Tourmaline Iones,N/A,$1609.09,https://www.fahorro.com/cepillo-electrico-giratorio-timco-cabello-tourmaline-iones.html
Termo de Acero Inoxidable de Doble Pared Vaso Térmico Extra Grande 1.5L,N/A,$516.62,https://www.fahorro.com/termo-de-acero-inoxidable-de-doble-pared-vaso-termico-extra-grande-1-5l-rosa.html
Clinique Tónico Facial Clarifying Lotion 3 200ml,N/A,$570.00,https://www.fahorro.com/clinique-tonico-facial-clarifying-lotion-3-200ml.html
HABITS Proteína de Origen Vegetal Sabor Cacao 1220g,N/A,$1756.25,https://www.fahorro.com/habits-proteina-de-origen-vegetal-sabor-cacao-1220g.html
TIMCO Freidora de Aire Sin Aceite Canasta 1 Litro,N/A,$892.94,https://www.fahorro.com/freidora-de-aire-sin-aceite-canasta-de-1-l-timco-af003r.html
Blender Bottle Termo Shaker Clasico 28oz Color Negro,N/A,$410.57,https://www.fahorro.com/termo-blender-bottle-clasico-v2-28-oz-negro.html
HABITS Proteína de Origen Vegetal Sabor Vanilla 1220g,N/A,$1756.25,https://www.fahorro.com/habits-proteina-de-origen-vegetal-sabor-vanilla-1220g.html
Neutrogena Pack Rutina Facil Hydroboost Acido Hialuronico Water Gel 50 gr + Serum + Crema de Ojos,N/A,$987.06,https://www.fahorro.com/neutrogena-pack-rutina-facil-hydroboost-acido-hialuronico-water-gel-50-gr-serum-crema-de-ojos-7501007535388.html
HONEST Pañal Desechable Etapa 3 Estampado Flower Power 27 pz,N/A,$353.33,https://www.fahorro.com/pa-al-etapa-3-flower-power-honest-27-pz.html
TIMCO Mini Refrigerador Portátil Frigobar 4 Litros Frío Calor,N/A,$1358.18,https://www.fahorro.com/mini-refrigerador-portatil-frigobar-de-4-l-cold-hot-timco.html
Perfume Versace Bright Crystal Eau de Toilette Mujer 90 ml,N/A,$2231.07,https://www.fahorro.com/perfume-versace-bright-crystal-eau-de-toilette-mujer-90ml.html
Conair Secadora 1875W Hammer Negra,N/A,$795.92,https://www.fahorro.com/secadora-1875w-hammer-negra-conair-secadoras-74108468499.html
Cámara de Seguridad WiFi HD Con Detección de Movimiento,N/A,$584.29,https://www.fahorro.com/camara-de-seguridad-wifi-hd-con-deteccion-de-movimiento.html
Clinique Hidratante Moisture Surge 100Hr 30 Ml,N/A,$630.00,https://www.fahorro.com/clinique-hidratante-moisture-surge-100hr-30ml.html
Clinique Suero Smart Clinical Repair Wrinkle Corrector Serum 50 Ml,N/A,$2400.00,https://www.fahorro.com/clinique-suero-smart-clinical-repair-wrinkle-corrector-serum-50ml.html
HONEST Loción Corporal Humectante Cuidado Mamá 236 ml,N/A,$525.00,https://www.fahorro.com/mom-care-locion-corporal-236-ml.html
Perfume Dolce & Gabbana Light Blue Eau Intense Eau de Parfum Mujer 100 ml,N/A,$1925.00,https://www.fahorro.com/perfume-dolce-gabbana-light-blue-eau-intense-eau-de-parfume-mujer-100ml.html
ATOMU Cebines Esencia Calmante de Hidratación Profunda 120 ml,N/A,$810.00,https://www.fahorro.com/atomu-cebines-esencia-calmante-120-ml.html
Biberón Advanced by Evenflo de Flujo Lento para Bebés Recien Nacidos 2oz,N/A,$112.86,https://www.fahorro.com/advanced-by-evenflo-biberon-2-oz.html
HONEST Pañal Desechable Etapa 3 Estampado Feeling Nauti 27 pz,N/A,$353.33,https://www.fahorro.com/pa-al-etapa-3-nauti-honest-27-pz.html
ORAL B Cepillo Dental 7 Beneficios 5 Pack,N/A,$178.57,https://www.fahorro.com/cepillo-dent-oral-b-7-beneficios-5pack.html
PAÑAL FISHER PRICE Etapa 6 Niña 40 Piezas,N/A,$282.65,https://www.fahorro.com/panal-para-bebe-etapa-6-nina-fisher-price-40-piezas-5807.html
Prensa Francesa de Acero Inoxidable Doble Pared 1 Litro,N/A,$746.74,https://www.fahorro.com/prensa-francesa-de-acero-inoxidable-doble-pared-1-litro-casa-litus.html
SASCHA FITNESS Crema de Cacahuate Natural con Proteína,N/A,$1699.00,https://www.fahorro.com/sascha-fitness-crema-de-cacahuate.html
Clinique Suero Moisture Surge Glow Active Serum 30 Ml,N/A,$990.00,https://www.fahorro.com/clinique-moisture-surge-active-glow-serum-30-ml.html
NUPEC Alimento Perro Adulto 5 kg,N/A,$665.56,https://www.fahorro.com/nupec-croquetas-adulto-7503008553217.html
Perfume Valentino Uomo Born in Roma Green Stravaganza Eau de Toilette Hombre 100 ml,N/A,$2348.75,https://www.fahorro.com/perfume-valentino-uomo-born-in-roma-green-stravaganza-eau-de-toilette-hombre-100ml.html
Perfume CH Carolina Herrera Very Good Girl Eau de Parfum Mujer 80 ml,N/A,$3943.64,https://www.fahorro.com/perfume-very-good-girl-eau-de-parfume-mujer-80ml.html
TIMCO Tenaza Waflera 3 Barrieles 33 Milímetros Rizadora,N/A,$834.55,https://www.fahorro.com/tenaza-waflera-para-cabello-3-barriles-33-mm-rizadora-cabell.html
YUYA Parche Auxiliar para Granitos 36 Piezas,N/A,$92.00,https://www.fahorro.com/parche-auxiliar-para-granitos-yuya-36-piezas-8472.html
XIAOMI SMART BAND 9 Glacier Silver,N/A,$775.02,https://www.fahorro.com/smartwatch-xiaomi-smart-band-9-silver-6941812775745.html
Clinique Hidratante Dramatically different moisturizing gel 125ml,N/A,$850.00,https://www.fahorro.com/clinique-hidratante-dramatically-different-moisturizing-gel-125ml.html
TIMCO Cepillo Alaciador Sohie Color Negro,N/A,$561.83,https://www.fahorro.com/cepillo-alaciador-sophie-negro.html
Clinique Delineador para Ojos QuickLiner Eyes-Really Black .3 g,N/A,$570.00,https://www.fahorro.com/clinique-delineador-q-liner-eyes-really-blacl-3gm-3-g.html
YUYA Desmaquillante 3 en 1 con 10 Aceites Naturales 125 ml,N/A,$192.86,https://www.fahorro.com/desmaquillante-3-en-1-con-10-aceites-naturales-yuya-125-ml-8480.html
Perfume Dolce & Gabbana Light Blue Eau de Toilette Mujer 100 ml,N/A,$1582.11,https://www.fahorro.com/light-blue-dama-de-dolce-gabbana-eau-de-toilette-100-ml.html
TIMCO Plancha Alaciadora para Cabello Cerámica + Ión,N/A,$793.82,https://www.fahorro.com/plancha-para-cabello-timco-alaciadora-pa-cm-ceramica-ion.html
TINY LIGHTWEIGHT CASUAL BACKPACK,N/A,$325.00,https://www.fahorro.com/mochila-tiny-ligera-para-uso-diario-azul-6972125146472.html
Audífonos Inalámbricos BT de Diadema con Cancelación Activa de Ruido Plegable,N/A,$861.80,https://www.fahorro.com/audifonos-inalambricos-bt-de-diadema-con-cancelacion-activa-de-ruido-plegable.html
Clinique Base Even Better Cliincal Foundation Spf 20 Wn 38 Stone 30 Ml,N/A,$999.00,https://www.fahorro.com/clinique-base-even-better-cliinical-foundation-spf-20-30ml2.html
LEGO Super Heroes Armadura Robótica de Superman vs. Lex Luthor,N/A,$392.31,https://www.fahorro.com/lego-armadura-robotica-de-superman-vs-lex-luthor-673419406239.html
Perfume CH Carolina Herrera 212 Men Eau de Toilette Hombre 100 ml,N/A,$2631.67,https://www.fahorro.com/perfume-212-men-eau-de-toilette-hombre-100ml.html
LEGO Speed Champions Supercoche Ferrari F40,N/A,$775.29,https://www.fahorro.com/lego-supercoche-ferrari-f40-673419400480.html
CRAZY AARONS Playful Puppy masilla sensorial,N/A,$380.00,https://www.fahorro.com/crazy-aaron-s-slime-sensorial-playful-puppy-saltarina.html
Perfume Versace Yellow Diamond Eau de Toilette Mujer 90 ml,N/A,$1692.74,https://www.fahorro.com/perfume-versace-yellow-diamond-eau-de-toilette-mujer-90ml.html
Clinique Corrector Even Better Concealer 6ml,N/A,$730.00,https://www.fahorro.com/clinique-corrector-even-better-concealer-6ml.html
TIMCO Sartén Eléctrico Antiadherente con Tapa de Vidrio,N/A,$892.94,https://www.fahorro.com/sarten-electrico-antiadherente-tapa-vidrio-timco-se2004.html
Molino de Café Eléctrico Profesional 200gr 18 Niveles de Molienda,N/A,$1149.46,https://www.fahorro.com/molino-de-cafe-electrico-profesional-200gr-18-niveles-de-molienda.html
Meibi Lubricante Íntimo de Caléndula,N/A,$652.00,https://www.fahorro.com/lub-calendula-lubricante-meibi-calendula.html
Perfume CH Carolina Herrera Bad Boy Le Parfum Eau de Parfum Hombre 100 ml,N/A,$3390.00,https://www.fahorro.com/perfume-bad-boy-le-parfum-eau-de-parfume-hombre-100ml.html
Clinique Crema para Ojos Smart Custom Repair Eye Treatment 15 Ml,N/A,$1699.00,https://www.fahorro.com/clinique-crema-para-ojos-smart-custom-repair-eye-treatment-15ml.html
TIMCO Tenaza Rizadora Extra Larga 22 cm Gold Radian Barril 25 Milímetros,N/A,$1013.85,https://www.fahorro.com/tenaza-rizadora-extra-larga-22-cm-gold-radian-tenaza-barril-25-mm-timco-trx-25.html
Perfume CH Carolina Herrera Good Girl Blush Elixir Eau de Parfum Mujer 80 ml,N/A,$4416.36,https://www.fahorro.com/perfume-good-girl-blush-elixir-eau-de-parfume-mujer-80ml.html
LEGO Juego de Construcción  Ford Mustang Dark Horse,N/A,$788.42,https://www.fahorro.com/lego-deportivo-ford-mustang-dark-horse-673419389075.html
Clinique Limpiador All About Clean Facial Soap mild 200ml,N/A,$610.00,https://www.fahorro.com/clinique-limpiador-all-about-clean-facial-soap-mild-200ml.html
CRAZY AARONS Putty Pets Curious Kitten versión sensorial,N/A,$380.00,https://www.fahorro.com/crazy-aaron-s-putty-pets-slime-sensorial-con-diseno-de-gatito-curious-kitten.html
TIMCO Depiladora y Rasuradora Eléctrica Color Rosa,N/A,$1027.27,https://www.fahorro.com/depiladora-y-rasuradora-rosa.html
Perfume Hugo Boss Green Eau de Toilette Hombre 125 ml,N/A,$1431.26,https://www.fahorro.com/perfume-hugo-green-eau-de-toilette-hombre-125ml.html
Perfume Ariana Grande Sweet Like Candy Eau de Parfum Mujer 100 ml,N/A,$2168.57,https://www.fahorro.com/perfume-ariana-grande-sweet-like-candy-eau-de-parfume-mujer-100ml.html
Perfume Jean Paul Gaultier Ultra Male Intense Eau de Toilette Hombre 125 ml,N/A,$2815.00,https://www.fahorro.com/perfume-jean-paul-gaultier-ultra-male-intense-eau-de-toilette-hombre-125ml.html
Bocina Bluetooth Inalámbrica Y Portátil Contra Agua,N/A,$460.00,https://www.fahorro.com/bocina-bluetooth-inalambrica-y-portatil-contra-agua.html
The Ordinary Salicylic Acid 0.5% Body Serum (Suero Corporal Exfoliante Con Ácido Salicílico),N/A,$360.00,https://www.fahorro.com/the-ordinary-salicylic-acid-0-5-body-serum-suero-corporal-exfoliante-con-acido-salicilico.html
Perfume Versace Eros Eau de Toilette Hombre 100 ml,N/A,$2243.70,https://www.fahorro.com/perfume-versace-eros-eau-de-toilette-hombre-100ml.html
ON Essential Amino Suplemento de Aminoácidos Sabor Sandía,N/A,$809.00,https://www.fahorro.com/on-essential-amino-sabor-sandia.html
Perfume Dolce & Gabbana The Only One Eau de Parfum Mujer 100 ml,N/A,$2771.30,https://www.fahorro.com/perfume-dolce-gabbana-the-only-one-eau-de-parfume-mujer-100ml.html
TIMCO Plancha para Cabello Sistema Antifrizz,N/A,$1294.60,https://www.fahorro.com/plancha-de-cabello-sistema-antifrizz-planchas-cabello-timco.html
XIAOMI SMART BAND 9 Mystic Rose,N/A,$775.02,https://www.fahorro.com/smartwatch-xiaomi-smart-band-9-rosa-mystic-6941812775790.html
Perfume Armaf Club de Nuit Urban Man Elixir Eau de Parfum Hombre 105 ml,N/A,$1672.50,https://www.fahorro.com/perfume-armaf-club-de-nuit-urban-man-elixir-eau-de-parfume-hombre-105ml.html
Clinique Hidratante Moisture Surge 100Hr 50 Ml,N/A,$1050.00,https://www.fahorro.com/clinique-hidratante-moisture-surge-100hr-50ml.html
Audífonos Inalámbricos Deportivos Open Ear Bluetooth 5.3 Resistencia IPX5,N/A,$807.69,https://www.fahorro.com/audifonos-inalambricos-deportivos-open-ear-bluetooth-5-3-resistencia-ipx5.html
YUYA Gel Fijador para Cejas 8 ml,N/A,$223.68,https://www.fahorro.com/gel-fijador-para-cejas-yuya-8-ml-4001.html
Perfume Britney Spears Fantasy Eau de Parfum Mujer 100 ml,N/A,$1055.55,https://www.fahorro.com/fantasy-de-britney-spears-eau-de-parfum-100-ml.html
NUPEC Alimento Perro Cachorro Raza Pequeña 2 kg,N/A,$450.00,https://www.fahorro.com/nupec-croquetas-puppy-razas-pequenas-7503008553040.html
Perfume Bharara King Eau de Parfum Hombre 100 ml,N/A,$2150.00,https://www.fahorro.com/perfume-bharara-king-eau-de-parfume-hombre-100ml.html
Perfume Versace Dylan Blue Eau de Toilette Hombre 100 ml,N/A,$1710.15,https://www.fahorro.com/perfume-versace-dylan-blue-eau-de-toilette-hombre-100ml.html
LEGO Speed Champions Superdeportivo Lamborghini V12 Vision GT,N/A,$775.00,https://www.fahorro.com/lego-superdeportivo-lamborghini-lambo-v12-vision-gt-673419389112.html
NUPEC Felino Adulto Indoor Hogar 3 kg,N/A,$511.86,https://www.fahorro.com/nupec-croquetas-gato-adulto-indoor-7503026084144.html
NARTEX PETS Multivitamínico Mascotas Soporte Nutricional Perro/Gato 90g,N/A,$298.52,https://www.fahorro.com/vitamin-pets-multivitaminico-para-perros-y-gatos-90-g-suplemento-alimenticio-en-croquetas-7501358174069.html
HEALTHADDICTION Glicinato de Magnesio 60 CAPS,N/A,$323.04,https://www.fahorro.com/healthaddiction-mag-glici-60-caps.html
Bravo Pets Arnes para Gato Ajustable 25-35cm Reflectante Color Negro Correa 120 cm,N/A,$223.09,https://www.fahorro.com/arnes-para-gato-color-negro-luz-nocturna-8783-bravo-mascotas-5546905208783.html
SASCHA BCAA + Glutamine Suplemento Sabor Sandía 350 gr,N/A,$1699.00,https://www.fahorro.com/sascha-fitness-bcaa-s-sandia.html
Clinique Mascara High Impact 3D Mascara 10 Ml,N/A,$690.00,https://www.fahorro.com/clinique-mascara-high-impact-3d-mascara-10-ml.html
Listerine Enjuague Bucal Cool Mint Zero 1L 3 Pack,N/A,$691.76,https://www.fahorro.com/listerine-enjuague-bucal-cool-mint-zero-1l-3-pack-7501007535630.html
The Ordinary Niacinamide 5% Face And Body (Emulsión Para Rostro Y Cuerpo Con Niacinamida),N/A,$400.00,https://www.fahorro.com/the-ordinary-niacinamide-5-face-and-body-emulsion-para-rostro-y-cuerpo-con-niacinamida.html
FRIDA MOM Botella Invertida para Limpieza Íntima,N/A,$533.30,https://www.fahorro.com/frida-mom-cuidado-de-la-mama-botella-invertida-para-limpieza-intima-851877006639.html
Clinique Hidratante Smart Clinical Wrinkle Corrector Cream 50 Ml,N/A,$2100.00,https://www.fahorro.com/clinique-hidratante-smart-clinical-wrinkle-corrector-cream-50ml.html
Clinique Crema para Ojos Aae Brightening Serum Concentrate 10 Ml,N/A,$1100.00,https://www.fahorro.com/clinique-crema-para-ojos-aae-brightening-serum-concentrate-10-ml.html
DORSO PET Antiparasitario Spot On Perro Mediano,N/A,$383.55,https://www.fahorro.com/dorso-pet-guard-spot-on-perro-med-7506419504953.html
Biberones Evenflo Advanced Set de 2 Mamila Ortodóntica Flujo Lento de 0 a 3 Meses,N/A,$178.57,https://www.fahorro.com/evenflo-advanced-set-de-2-biberones-con-mamila-ortodontica-flujo-lento-para-bebes-de-0-a-3-meses.html
"Clinique Desmaquillante take the day off lids, lashes & lips 125ml",N/A,$540.00,https://www.fahorro.com/clinique-desmaquillante-take-the-day-off-lids-lashes-lips-125ml.html
Set de Doctor Infantil con Maletín y Accesorios,N/A,$765.55,https://www.fahorro.com/set-de-doctor-infantil-con-maletin-y-accesorios.html
DORSO PET Antiparasitario Spot On Gatos,N/A,$333.86,https://www.fahorro.com/dorso-pet-guard-spot-on-gatos-7506419504915.html
FISHER PRICE Toallitas Húmedas con Aroma 80 Toallitas,N/A,$65.33,https://www.fahorro.com/toallitas-humedas-con-aroma-fisher-price-80-toallitas-4510.html
WHITE RAIN Toallitas Húmedas Bebé Premium,N/A,$58.33,https://www.fahorro.com/bebe-whiterain-whiterainbabywipespremium.html
GRANDPET Receta de Pavo Alimento Húmedo 100 g,N/A,$35.86,https://www.fahorro.com/alimento-bravo-mascotas-7501856504443.html
FRIDA MOM Cepillo de Dientes Dedal,N/A,$286.30,https://www.fahorro.com/frida-baby-cuidado-dental-para-bebes-cepillo-de-dientes-dedal-810028771789.html
Glitz Girlz Trendy Traveler Set de Juguete 10 Piezas,N/A,$817.76,https://www.fahorro.com/glitz-girlz-trendy-traveler-set-de-juguete-con-bolso-y-accesorios-10-piezas.html
Clinique Limpiador Facial All Bout Clean Piel Grasa 200ml,N/A,$610.00,https://www.fahorro.com/clinique-limpiador-all-about-clean-facial-soap-oily-skin-200ml.html
NARTEX PETS Aceite de Salmón Omega 3 para Piel y Pelaje Perro/Gato 250 ml,N/A,$350.75,https://www.fahorro.com/suplemento-aceite-de-salmon-para-perros-y-gatos-250-ml-suplemento-alimenticio-en-croquetas-7501358174021.html
HONEST Shampoo y Gel de Baño Piel Sensible Sin Fragancia 295 ml,N/A,$309.84,https://www.fahorro.com/shampo-body-wash-piel-sensible-libre-de-fragancia-295-ml.html
GRANDPET Receta de Cordero Alimento Húmedo 100 g,N/A,$35.86,https://www.fahorro.com/alimento-bravo-mascotas-7501856504450.html
TINY LIGHTWEIGHT CASUAL BACKPACK,N/A,$325.00,https://www.fahorro.com/mochila-tiny-ligera-para-uso-diario-naranja-6972125146489.html
Clinique Protector Solar Super Defense Spf50 40 Ml,N/A,$999.00,https://www.fahorro.com/clinique-protector-solar-super-defense-spf50-40ml.html
LEGO Juego de Construcción  Coche De Carreras De Fórmula 1 Mclaren 2023,N/A,$761.73,https://www.fahorro.com/lego-coche-de-carreras-de-formula-1-mclaren-2023-673419389068.html
PAÑAL FISHER PRICE Etapa 6 Niño 40 Piezas,N/A,$282.65,https://www.fahorro.com/panal-para-bebe-etapa-6-nino-fisher-price-40-piezas-4596.html
Spray Desenredante Honest de Naranja y Vainilla 118 ml,N/A,$215.00,https://www.fahorro.com/honest-co-spray-desenredante-118-ml.html
NUPEC Felino Adulto Indoor Hogar 1.5 kg,N/A,$283.33,https://www.fahorro.com/nupec-croquetas-gato-adulto-indoor-7503026084137.html
SASCHA BCAA + Glutamine Suplemento Sabor Uva 350 gr,N/A,$1499.00,https://www.fahorro.com/sascha-fitness-bcaa-s-uva.html
Organizador Giratorio Lazy Susan de Madera de Acacia 38 cm,N/A,$700.00,https://www.fahorro.com/organizador-giratorio-lazy-susan-de-madera-de-acacia-38-cm-casa-litus.html
The Ordinary Uv Filters 45 Spf 60 Ml (Protector Solar Spf 45 En Suero),N/A,$460.00,https://www.fahorro.com/the-ordinary-uv-filters-45-spf-60-ml-protector-solar-spf-45-en-suero.html
XIAOMI TRITAN Water Bottle White Elegante 750 ml,N/A,$364.78,https://www.fahorro.com/xiaomi-botella-de-agua-tritan-blanca.html
CRAZY AARONS Slime Watermelon Birthday Cake con aromas y diversión,N/A,$340.83,https://www.fahorro.com/crazy-aaron-s-slime-sensorial-con-aroma-frutal-watermelon-birthday-cake.html
ON GS 100% Whey Chocolate Blanco Proteína en Polvo 5 LB,N/A,$2399.00,https://www.fahorro.com/on-gs-100-whey-chocolate-blanco-bote-5-lb.html
